{
  "entries": [
    {
      "canonical_field_id": "UOM-AVE-CT02",
      "cell_round_trip": {
        "raw_value_sha256": "d7bf8df2a1e027b82696fcf22a6b64278d8b3b2a3a23d2d985d022a487cd88a0",
        "status": "pass"
      },
      "metadata": {
        "required": true,
        "scope": "FORMULA-02",
        "type": "raw_text",
        "unit": null
      },
      "occurrence_id": "occ-06be0fc602f9ae94749463573408c6d03177f000d4c8aac3b1a5c6911f45a07a",
      "owner": {
        "grid_span": 1,
        "kind": "cell",
        "logical_column_end": 5,
        "logical_column_start": 5,
        "physical_cell": 5,
        "row": 3,
        "table": 3,
        "vertical_merge": {
          "group_id": null,
          "state": "none"
        }
      },
      "raw_source_token": "<UOM-AVE-CT02>",
      "raw_value": "100,4",
      "raw_value_sha256": "d7bf8df2a1e027b82696fcf22a6b64278d8b3b2a3a23d2d985d022a487cd88a0",
      "record_id": null
    },
    {
      "canonical_field_id": "THICKNESS-MIN-CT02",
      "cell_round_trip": {
        "raw_value_sha256": "82c70f87a12df101b3b45c63310a2df8c080481995a8cec3d5b862daab90b462",
        "status": "pass"
      },
      "metadata": {
        "required": true,
        "scope": "FORMULA-02",
        "type": "raw_text",
        "unit": null
      },
      "occurrence_id": "occ-086577f8facf60b0aa82a1c896ae2d2a91f7657e9861fe1382f936c5d58754f6",
      "owner": {
        "grid_span": 1,
        "kind": "cell",
        "logical_column_end": 5,
        "logical_column_start": 5,
        "physical_cell": 5,
        "row": 11,
        "table": 3,
        "vertical_merge": {
          "group_id": null,
          "state": "none"
        }
      },
      "raw_source_token": "<THICKNESS-MIN-CT02>",
      "raw_value": "2,73",
      "raw_value_sha256": "82c70f87a12df101b3b45c63310a2df8c080481995a8cec3d5b862daab90b462",
      "record_id": null
    },
    {
      "canonical_field_id": "AV-CT03",
      "cell_round_trip": {
        "raw_value_sha256": "00268f57a720d33d82387522a1bf4361cbd7c8ed67ea3733de0e7fd86f0b7e65",
        "status": "pass"
      },
      "metadata": {
        "required": true,
        "scope": "FORMULA-03",
        "type": "raw_text",
        "unit": null
      },
      "occurrence_id": "occ-0e5e1acf60509b40fdb4affd8ff46fffefacfb6de2f3e4920dbff73602bb8c1c",
      "owner": {
        "grid_span": 1,
        "kind": "cell",
        "logical_column_end": 6,
        "logical_column_start": 6,
        "physical_cell": 5,
        "row": 23,
        "table": 3,
        "vertical_merge": {
          "group_id": null,
          "state": "none"
        }
      },
      "raw_source_token": "<AV-CT03>",
      "raw_value": "3,04",
      "raw_value_sha256": "00268f57a720d33d82387522a1bf4361cbd7c8ed67ea3733de0e7fd86f0b7e65",
      "record_id": null
    },
    {
      "canonical_field_id": "PDS-180-150-CT03",
      "cell_round_trip": {
        "raw_value_sha256": "8a781f7aeef9e0bd0f2d1aeb2a7ddfe21f917399eb4caf89f4a3146f411d17be",
        "status": "pass"
      },
      "metadata": {
        "required": true,
        "scope": "FORMULA-03",
        "type": "raw_text",
        "unit": null
      },
      "occurrence_id": "occ-1506f082e3d0da98719f8cdd309614d35059f840d8b3e415cc3bd533aff35be5",
      "owner": {
        "grid_span": 1,
        "kind": "cell",
        "logical_column_end": 6,
        "logical_column_start": 6,
        "physical_cell": 6,
        "row": 6,
        "table": 2,
        "vertical_merge": {
          "group_id": null,
          "state": "none"
        }
      },
      "raw_source_token": "<PDS-180-150-CT03>",
      "raw_value": "18,21",
      "raw_value_sha256": "8a781f7aeef9e0bd0f2d1aeb2a7ddfe21f917399eb4caf89f4a3146f411d17be",
      "record_id": null
    },
    {
      "canonical_field_id": "UOM-AVE-CT01",
      "cell_round_trip": {
        "raw_value_sha256": "6e4d69f287101586a4e683741adb8839713e5640645e6134dc8a4f06e12c2568",
        "status": "pass"
      },
      "metadata": {
        "required": true,
        "scope": "FORMULA-01",
        "type": "raw_text",
        "unit": null
      },
      "occurrence_id": "occ-16ee7f4c3eb9bdbbe38c8105292d2bce9fe8c902e1baa7aa2987cf2348317c7b",
      "owner": {
        "grid_span": 1,
        "kind": "cell",
        "logical_column_end": 4,
        "logical_column_start": 4,
        "physical_cell": 4,
        "row": 3,
        "table": 3,
        "vertical_merge": {
          "group_id": null,
          "state": "none"
        }
      },
      "raw_source_token": "<UOM-AVE-CT01>",
      "raw_value": "100,3",
      "raw_value_sha256": "6e4d69f287101586a4e683741adb8839713e5640645e6134dc8a4f06e12c2568",
      "record_id": null
    },
    {
      "canonical_field_id": "API-CONTENT-CT01",
      "cell_round_trip": {
        "raw_value_sha256": "a370ef10025e764d34d688bf66099093aa7ad39631eba46836aef63e86062d7d",
        "status": "pass"
      },
      "metadata": {
        "required": true,
        "scope": "FORMULA-01",
        "type": "raw_text",
        "unit": null
      },
      "occurrence_id": "occ-16f5b58d279caa9585d957df4411e5307f55d4e23b3c2ae9f18950571e6dc5bf",
      "owner": {
        "grid_span": 1,
        "kind": "cell",
        "logical_column_end": 3,
        "logical_column_start": 3,
        "physical_cell": 3,
        "row": 3,
        "table": 1,
        "vertical_merge": {
          "group_id": null,
          "state": "none"
        }
      },
      "raw_source_token": "<API-CONTENT-CT01>",
      "raw_value": "10,00",
      "raw_value_sha256": "a370ef10025e764d34d688bf66099093aa7ad39631eba46836aef63e86062d7d",
      "record_id": null
    },
    {
      "canonical_field_id": "FRIABILITY-CT02",
      "cell_round_trip": {
        "raw_value_sha256": "3bf56319cb776544c8be22ece8c45bda0aeb2160289ffe48a83a4245a0943f13",
        "status": "pass"
      },
      "metadata": {
        "required": true,
        "scope": "FORMULA-02",
        "type": "raw_text",
        "unit": null
      },
      "occurrence_id": "occ-17e5474e93cc803b86c5c76dff31135470eaeb82d832e6a270d4b02e237f0def",
      "owner": {
        "grid_span": 1,
        "kind": "cell",
        "logical_column_end": 5,
        "logical_column_start": 5,
        "physical_cell": 4,
        "row": 12,
        "table": 3,
        "vertical_merge": {
          "group_id": null,
          "state": "none"
        }
      },
      "raw_source_token": "<FRIABILITY-CT02>",
      "raw_value": "0,02",
      "raw_value_sha256": "3bf56319cb776544c8be22ece8c45bda0aeb2160289ffe48a83a4245a0943f13",
      "record_id": null
    },
    {
      "canonical_field_id": "EXCIPIENT-4-%-CT02",
      "cell_round_trip": {
        "raw_value_sha256": "a8ea39aa2b6357935392aeab9e6cbc61e4d384a87f5907d7c5a54f34681b2a13",
        "status": "pass"
      },
      "metadata": {
        "required": true,
        "scope": "FORMULA-02",
        "type": "raw_text",
        "unit": null
      },
      "occurrence_id": "occ-1ab339f0b54a1085b6934636e284987a6d62ceb31f462e8da80f667d8ef465f6",
      "owner": {
        "grid_span": 1,
        "kind": "cell",
        "logical_column_end": 6,
        "logical_column_start": 6,
        "physical_cell": 6,
        "row": 7,
        "table": 1,
        "vertical_merge": {
          "group_id": null,
          "state": "none"
        }
      },
      "raw_source_token": "<EXCIPIENT-4-%-CT02>",
      "raw_value": "3,30",
      "raw_value_sha256": "a8ea39aa2b6357935392aeab9e6cbc61e4d384a87f5907d7c5a54f34681b2a13",
      "record_id": null
    },
    {
      "canonical_field_id": "DISSOLUTION-MAX-CT03",
      "cell_round_trip": {
        "raw_value_sha256": "0b438266819494fb0ec4a164fc6f8d74a85dca8f32ed7f730c7a26ddc4ab3301",
        "status": "pass"
      },
      "metadata": {
        "required": true,
        "scope": "FORMULA-03",
        "type": "raw_text",
        "unit": null
      },
      "occurrence_id": "occ-22061b1aef32801662711703876e47bfca8bb1a4600760b7567be5085a325670",
      "owner": {
        "grid_span": 1,
        "kind": "cell",
        "logical_column_end": 6,
        "logical_column_start": 6,
        "physical_cell": 6,
        "row": 17,
        "table": 3,
        "vertical_merge": {
          "group_id": null,
          "state": "none"
        }
      },
      "raw_source_token": "<DISSOLUTION-MAX-CT03>",
      "raw_value": "100,98",
      "raw_value_sha256": "0b438266819494fb0ec4a164fc6f8d74a85dca8f32ed7f730c7a26ddc4ab3301",
      "record_id": null
    },
    {
      "canonical_field_id": "ASSAY-CT03",
      "cell_round_trip": {
        "raw_value_sha256": "07ee3a1d8df963974f5e00ed5d1e070907421de66304ee044d3747f99c16b2c0",
        "status": "pass"
      },
      "metadata": {
        "required": true,
        "scope": "FORMULA-03",
        "type": "raw_text",
        "unit": null
      },
      "occurrence_id": "occ-233e809dcc680a4a923757adc34592a7be3323c1bdea33c63e21c7b0216c5f31",
      "owner": {
        "grid_span": 1,
        "kind": "cell",
        "logical_column_end": 6,
        "logical_column_start": 6,
        "physical_cell": 5,
        "row": 15,
        "table": 3,
        "vertical_merge": {
          "group_id": null,
          "state": "none"
        }
      },
      "raw_source_token": "<ASSAY-CT03>",
      "raw_value": "99,99",
      "raw_value_sha256": "07ee3a1d8df963974f5e00ed5d1e070907421de66304ee044d3747f99c16b2c0",
      "record_id": null
    },
    {
      "canonical_field_id": "EXCIPIENT-6",
      "cell_round_trip": {
        "raw_value_sha256": "945e2c17a2d6fae4a9b3ece2f796624c77792bcae490c7e6ab5ebd3c7c85e1c2",
        "status": "pass"
      },
      "metadata": {
        "required": true,
        "scope": "all-formulations",
        "type": "raw_text",
        "unit": null
      },
      "occurrence_id": "occ-246a5f060cb6046fb4679b3f796385ef171eb507ea97c84e022a3a492765139e",
      "owner": {
        "grid_span": 1,
        "kind": "cell",
        "logical_column_end": 2,
        "logical_column_start": 2,